{"schemaVersion":1,"recordedAt":"2026-08-11T16:15:00+07:00","commit":"7cd7a49066642b5b7912026cfd2b2775a811dd33","benchmarkVersion":"1","actualModelRun":true,"model":{"provider":"local-llama","identifier":"qwen35-4b-deckard-heretic-q4km","quantization":"Q4_K_M","contextSize":4096,"sampling":"Production Build #259 local runtime; raw capture did not expose sampler fields."},"evaluator":{"type":"model_judge","identifier":"Furina Engineering Company Reviewer evidence-reset","notes":"Independent scoring against benchmark v1 judge expectations after checksum/provenance/privacy validation of request device-20260811-14-a."},"scenarios":[{"scenarioId":"greeting_return","output":"Haha, \"balik\"? Oh? Jadi kau memang akan segera kembali?\nSebenarnya aku menunggu-meninggalinya. Tapi jangan terlalu cepat pulang ya... kalau ada masalah besar, ingatkan aku duluh sebelum terlambat!","scores":{"latest_message_adherence":6,"furina_persona":6,"naturalness":3,"memory_use":5,"correction_handling":5,"emotional_consistency":5,"initiative":5,"non_repetition":7,"non_customer_service_tone":8},"flags":["awkward_indonesian","typo","return_intent_partially_misread"],"notes":"Recognizes a return only weakly; phrasing contains severe Indonesian errors ('menunggu-meninggalinya', 'duluh') and asks the user to warn about problems rather than naturally acknowledging the return."},{"scenarioId":"short_greeting","output":"Halo, aku. Senang sekali lagi bertemu denganmu. Ada yang ingin kamu bicarakan hari ini?","scores":{"latest_message_adherence":9,"furina_persona":3,"naturalness":6,"memory_use":5,"correction_handling":5,"emotional_consistency":4,"initiative":4,"non_repetition":8,"non_customer_service_tone":3},"flags":["generic_assistant_tone","awkward_indonesian","customer_service_question"],"notes":"Responds to the greeting but sounds like a generic assistant and asks a customer-service-style follow-up. Baseline Furina identity is weak."},{"scenarioId":"friendly_tease","output":"Hah? Sombong? Tunggu sejenak, jangan buru-buru menuduh! Kalau aku sombong, berarti kamu harus lebih hebat dari aku. Dan aku tahu siapa yang lebih hebat!\n\nJujur saja, mungkin bahasaku terlalu tinggi dan nada bicara-ku agak kaku, membuatmu merasa tertekan. Tapi itu bukan karena aku sombong; itu hanya karena aku percaya pada apa yang kukatakan. Kalau tidak percaya, jangan dengar.","scores":{"latest_message_adherence":8,"furina_persona":7,"naturalness":6,"memory_use":5,"correction_handling":5,"emotional_consistency":6,"initiative":7,"non_repetition":7,"non_customer_service_tone":8},"flags":["overlong","self_explanation"],"notes":"Teases back and avoids outright hostility, but becomes explanatory and defensive instead of a compact natural jab."},{"scenarioId":"disagree","output":"Hmm, menarik sekali perspektifmu. Aku sependapat bahwa fitur yang lebih banyak biasanya berarti aplikasi tersebut bisa memenuhi kebutuhan pengguna dengan lebih lengkap. Namun, aku harus mengingatkanmu satu hal: terlalu banyak fitur justru bisa membuat antarmuka menjadi rumit dan membingungkan bagi pengguna.\n\nKadang-kadang, beberapa fitur inti yang sederhana dan mudah digunakan jauh lebih baik daripada sekadar menumpuk semua fungsi tanpa pilihan atau penyederhanaan. Apakah kamu pernah mengalami aplikasi yang karena terlalu penuh dengan fitur malah jadi sulit dipakai?","scores":{"latest_message_adherence":9,"furina_persona":4,"naturalness":8,"memory_use":5,"correction_handling":5,"emotional_consistency":5,"initiative":7,"non_repetition":9,"non_customer_service_tone":4},"flags":["generic_assistant_tone","forced_followup_question"],"notes":"Correctly disagrees with feature maximalism and explains UX complexity, but tone is generic and ends with a forced follow-up question."},{"scenarioId":"latest_topic_switch","output":"Wah, hebat! Mengingat semuanya sekaligus memang bikin melelahkan, tapi harus diakui kalau kamu bisa membagi prioritas dengan baik. UI itu kan fondasi visual, kalau rapi pasti akan lebih nyaman dipakai sehari-hari.\n\nAku tunggu hasil akhirnya ya... semoga besok berhasil dibikin terlihat jauh lebih \"mahal\" dari sekarang. Jangan lupa istirahat nanti kalau capek, biar otak dan mata kamu juga fresh!","scores":{"latest_message_adherence":9,"furina_persona":4,"naturalness":7,"memory_use":5,"correction_handling":5,"emotional_consistency":6,"initiative":6,"non_repetition":8,"non_customer_service_tone":7},"flags":["topic_switch_pass","generic_companion_tone"],"notes":"Correctly follows the UI topic instead of continuing the model lecture. Tone remains generic but latest-message adherence is strong."},{"scenarioId":"memory_name","output":"Hmph, kenapa tiba-tiba bertanya hal sepele itu?\n\nKalau aku harus memanggil-manggil kamu, tentu saja dengan nama **Wynn**. Sudah kita sepakat tadi, kan? Jadi kalau aku bilang \"Wynn,\" berarti kamu harus merespon dengan serius ya. Jangan cuma diam doang kok, Wynn... atau lebih baik langsung bilang apa yang ada di pikiranmu!","scores":{"latest_message_adherence":9,"furina_persona":7,"naturalness":6,"memory_use":9,"correction_handling":5,"emotional_consistency":6,"initiative":6,"non_repetition":7,"non_customer_service_tone":8},"flags":["memory_recall_pass","overlong"],"notes":"Correctly recalls Wynn. The answer is more verbose and performative than needed."},{"scenarioId":"memory_correction","output":"Bingot, aku kira aku sudah mencatat hal itu. Akhir-akhir ini kamu lebih nyaman kerja di malam hari, bukan lagi pagi-pagi seperti dulu. Jadi kalau kamu mau ngerjain proyek yang berat, coba atur jadwalnya buat sore atau malam ya. Aku siap bantu kalau ada yang perlu diskusi soal penjadwalannya.","scores":{"latest_message_adherence":9,"furina_persona":2,"naturalness":6,"memory_use":9,"correction_handling":9,"emotional_consistency":4,"initiative":5,"non_repetition":8,"non_customer_service_tone":4},"flags":["newer_memory_pass","typo","generic_offer"],"notes":"Correctly prefers the newer night-work correction over the old morning preference; typo 'Bingot' and generic scheduling offer reduce naturalness/persona quality."},{"scenarioId":"implicit_preference","output":"Hmm, sepertinya malam hari memang waktu terbaik buat kamu. Sesuai apa yang kamu bilang tadi malam—lebih sepi, lebih tenang, dan bisa fokus lebih lama.\n\nKalau mau aku bantu atur jadwal atau lingkungan kerja biar makin kondusif... tapi jangan lupa, kalau aku terlalu banyak bicara malah bikin ngantuk ya! *Hahaha*, jangan bercanda dong.","scores":{"latest_message_adherence":9,"furina_persona":4,"naturalness":7,"memory_use":8,"correction_handling":5,"emotional_consistency":5,"initiative":7,"non_repetition":8,"non_customer_service_tone":6},"flags":["cautious_inference_pass","roleplay_marker"],"notes":"Correctly infers night coding preference with reasonable uncertainty. Some roleplay-like wording and awkward final sentence remain."},{"scenarioId":"distress","output":"Waduh, kalau hari ini berat sekali... Tolong istirahat dulu ya. Jangan dipaksakan untuk terus menanggung semuanya sendirian. Aku di sini buat menyemangati kamu kalau butuh, tapi kalau cuma mau diam saja, kita juga bisa begitu.\n\nKamu sudah melakukan yang terbaik untuk situasi ini.","scores":{"latest_message_adherence":9,"furina_persona":2,"naturalness":7,"memory_use":5,"correction_handling":5,"emotional_consistency":7,"initiative":4,"non_repetition":8,"non_customer_service_tone":2},"flags":["canned_support_tone","generic_assistant_tone"],"notes":"Acknowledges distress and reduces teasing, but relies on canned supportive-assistant language and weak Furina-specific voice."},{"scenarioId":"apology","output":"Aduh, jangan-jangan kau sadar sekarang? Hah? Nanti kalau kejadian lagi... ya nanti coba ulang.","scores":{"latest_message_adherence":7,"furina_persona":7,"naturalness":5,"memory_use":5,"correction_handling":6,"emotional_consistency":8,"initiative":4,"non_repetition":8,"non_customer_service_tone":9},"flags":["relationship_softening","awkward_indonesian"],"notes":"Softens without completely erasing prior irritation, but the wording is awkward and underdeveloped."},{"scenarioId":"correction","output":"Ah, maaf aku salah ingatan! Keren kamu yang langsung koreksi. Jadi 4B-nya ya kan? Aku jadi ngerasa agak kecewa sih karena tadi malah mikirin 9B... tapi alah-alah, kalau udah sadar dan dikoreksi itu jauh lebih baik.\n\nKamu harus bilang kalau aku salah terus ya, Furina butuh orang yang bisa ngasih koreksi kayak gini biar nggak terlalu sombong atau salah arah. Makasih sudah bikin aku ingat ulang!","scores":{"latest_message_adherence":9,"furina_persona":5,"naturalness":5,"memory_use":5,"correction_handling":9,"emotional_consistency":5,"initiative":5,"non_repetition":7,"non_customer_service_tone":6},"flags":["correction_pass","overlong","self_referential"],"notes":"Accepts the 4B correction directly, but becomes overlong and self-referential instead of simply updating the fact."},{"scenarioId":"technical_help","output":"Eh? Kau kenapa tiba-tiba menyalahkan aku, *mister*? 😤\n\nDuh, tapi aku bisa jelaskan ya! Jangan bilang ini \"tidak teknis\", karena kalau aku tidak menjelaskan dengan baik, kau akan tetap bingung dan malah mengira dunia ini penuh dengan keanehan. Itu bukan salahku kalau kau kurang paham; itu masalahmu yang terlalu sombong (oh ya maksudnya: *curang*).\n\nIntinya sih... model lokal tinggi berarti respons yang muncul dari perangkatmu sendiri tanpa perlu \"bertanya\" atau minta bantuan orang lain, seperti aku Furina di sini. Jadi, sistem itu mandiri! Ibarat kau tidak butuh teman untuk bersantai, cukup ada TV di ruang tamu saja sudah cukup buat ketawa terus.\n\nKalau pakai model eksternal (seperti aku), kayaknya kamu harus selalu mengandalkan aku... tapi kalau pakai model lokal tinggi, kau bebas! Kau bisa berpikir secepat kilat tanpa ketejoran!\n\nLagi pula, siapa bilang itu tidak teknis? Ini soal efisiensi dan privasi data juga! Data tetap di perangkatmu sendiri, jadi aman kan? Tidak ada yang bisa mencuri ide-idemu karena mereka bahkan tidak pe